,text,Mapping,word_count,unique_wordcount,mean_word_length,tweet_length,url_count,hashtags,mention_count,stopwords,punctuation_count,text_Adjectives,Processed_Text
675,then that means it HAS to be square to him @user @user @user @user @user,0,15,10,3.87,72,0,0,1,8,5,square,then that means it has to be square to him     
676,@user @user I love button pushers!,1,6,5,4.83,34,0,0,1,1,3,,  i love button pushers
677,Watching #Bones &cradled my leg when I saw @user in episode about chicken #tasteslikechicken #termite #TheWalkingDead @user,0,17,16,6.29,123,0,1,1,5,7,tasteslikechicken termite,watching bones cradled my leg when i saw  in episode about chicken tasteslikechicken termite thewalkingdead 
678,2 and half hour walk #Proud,0,6,6,3.67,27,0,1,0,1,1,half, and half hour walk proud
679,I am extremely excited to know what Reza Aslan and CJ Werleman think about what happened in Pakistan #PeshawarAttack,1,19,18,5.16,116,0,1,0,8,1,excited,i am extremely excited to know what reza aslan and cj werleman think about what happened in pakistan peshawarattack
680,@user Thank you @user for having me on the cover of the Feminism issue. My favourite magazine cover ever. LorraineELLE X,1,21,18,4.76,120,0,0,1,9,4,favourite, thank you  for having me on the cover of the feminism issue my favourite magazine cover ever lorraineelle x
681,Hahahhaha that really made me jelouse,1,6,6,5.33,37,0,0,0,2,0,,hahahhaha that really made me jelouse
682,I just love EU servers....,1,5,5,4.4,26,0,0,0,2,4,,i just love eu servers
683,Xmas on the blog feat intimissimiofficial and @user * Read our story and share the LOVE...,0,16,14,4.69,90,0,0,1,6,5,intimissimiofficial @,xmas on the blog feat intimissimiofficial and   read our story and share the love
684,Well that's me living till I'm 200yrs old!!! #sarci   #wit #low #constant,1,12,12,5.0,73,0,1,0,3,9,old sarci wit low constant,well thats me living till im yrs old sarci   wit low constant
685,"She heard Him cry and His little fingers & toes were counted and Mary exclaimed ""He's PERFECT!""  Oh Mary, you so cray cray.",1,23,22,4.35,123,0,0,0,8,7,little PERFECT cray,she heard him cry and his little fingers  toes were counted and mary exclaimed hes perfect  oh mary you so cray cray
686,@user Think I may use that in my ads ! :),1,11,11,2.82,41,0,0,1,4,4,, think i may use that in my ads  
687,@user What's with the ridiculous hashtagging? #massive #twat,0,8,8,6.62,60,0,1,1,3,5,ridiculous massive, whats with the ridiculous hashtagging massive twat
688,SEEING @user ON SATURDAY whaddddddup #legend,1,6,6,6.5,44,0,1,1,1,2,,seeing  on saturday whaddddddup legend
689,I #may or may  be #watching #Rockos #Modern #Life... #ForeverA90sKid #ImNotTheWallabyIusedToBe,0,11,11,7.55,94,0,1,0,3,10,,i may or may  be watching rockos modern life foreveraskid imnotthewallabyiusedtobe
690,Happy 2nd anniversary to me in SGV. Happy OT here in client. Woohoo. I loooooove my job. Super. More years to go!!!!!!!!!,1,22,19,4.55,121,0,0,0,9,14,Happy Happy,happy nd anniversary to me in sgv happy ot here in client woohoo i loooooove my job super more years to go
691,Getting ready #yesterday #christmaseve #lastnight,0,5,5,9.0,49,0,1,0,0,3,ready christmaseve,getting ready yesterday christmaseve lastnight
692,"@user No, voting somebody in because they're from Latvia is way more important than voting for the best players.",1,19,18,4.95,112,0,0,1,9,4,important, no voting somebody in because theyre from latvia is way more important than voting for the best players
693,@user @user @user @user  for Elrufai#he represents the masses#so it is our victory#,0,13,10,5.38,83,0,1,1,5,7,,     for elrufaihe represents the massesso it is our victory
694,"Being publicly called a ""heartless arsehole"" for going about my day as usual.",1,13,13,5.0,77,0,0,0,6,3,heartless usual,being publicly called a heartless arsehole for going about my day as usual
695,"So, Matt and Natasha are having sex. #WhatASuprise  #WhatElseIsNew",1,9,9,6.33,66,0,1,0,3,4,,so matt and natasha are having sex whatasuprise  whatelseisnew
696,I LOVE not sleeping. It's the best.,1,7,7,4.14,35,0,0,0,4,3,,i love not sleeping its the best
697,"Stop living like a king, you're not one So using this in real life. #ExodusMovie",0,15,15,4.4,80,0,1,0,7,4,real,stop living like a king youre not one so using this in real life exodusmovie
698,"@user  I'm really big supporter of #lawenforcement. Like Sheriff Clarke said, it's all theatrics. #Ferguson @user",1,16,15,6.06,113,0,1,1,5,9,big,  im really big supporter of lawenforcement like sheriff clarke said its all theatrics ferguson 
699,"Country music & photo editing, my type of morning â˜€ï¸ðŸŽ¶",0,10,10,4.4,53,0,0,0,2,2,,country music  photo editing my type of morning â˜€ï¸ðŸŽ¶
700,Cocktails tonight yep why not!   had one in over a year! !,0,12,12,3.75,58,0,0,0,5,3,,cocktails tonight yep why not   had one in over a year 
701,"@user if you don't want to upgrade your iOS or keep many pictures, yeah it's great",1,16,16,4.19,82,0,0,1,7,4,many great, if you dont want to upgrade your ios or keep many pictures yeah its great
702,Coffee and Fiber One. It's worth getting up for.,1,9,9,4.44,48,0,0,0,3,3,,coffee and fiber one its worth getting up for
703,"The silence in #TimesSquare for #EricGarner last night is only broken by #NYPD siren. , watch on ifussss app.",1,19,19,4.79,109,0,1,0,7,6,last ifussss,the silence in timessquare for ericgarner last night is only broken by nypd siren  watch on ifussss app
704,She can get it raw !!!,0,6,6,2.83,22,0,0,0,4,3,raw,she can get it raw 
705,Found out the reason that weekend closer makes my life miserable is because I'm atheist. #hypocrite #atheistproblems #serverproblems,0,18,18,6.39,132,0,1,0,7,5,atheist hypocrite,found out the reason that weekend closer makes my life miserable is because im atheist hypocrite atheistproblems serverproblems
706,that is the face of a tired man hahahahah,0,9,9,3.67,41,0,0,0,5,0,tired,that is the face of a tired man hahahahah
707,@user I thought it funny ;p,0,6,6,3.67,27,0,0,1,2,2,, i thought it funny p
708,there are things we are made to go through  to harm us but to given us a lesson to teach to someone weaker,0,23,17,3.61,106,0,0,0,12,0,,there are things we are made to go through  to harm us but to given us a lesson to teach to someone weaker
709,In other news i havent had a good nights sleep in a week. I feel great.,1,16,15,3.5,71,0,0,0,8,2,other good great,in other news i havent had a good nights sleep in a week i feel great
710,"Sarcasm incoming: This weekend is going to be such a great time being grounded with nothing to do but homework, gunna have a blast!",1,24,22,4.5,131,0,0,0,13,3,such great,sarcasm incoming this weekend is going to be such a great time being grounded with nothing to do but homework gunna have a blast
711,Lol boy i just wanted a fuck not a relationship  trying to sound like a hoe.,1,16,14,3.75,76,0,0,0,8,1,,lol boy i just wanted a fuck not a relationship  trying to sound like a hoe
712,"Final at 7am, I'm ready",1,5,5,3.8,23,0,0,0,2,2,ready,final at am im ready
713,"Wearing my @user rangers shirt, flipping off a crowd in his hometown of boston. So much",1,16,16,4.5,87,0,0,1,7,3,much,wearing my  rangers shirt flipping off a crowd in his hometown of boston so much
714,Ed Sheeran smashing out his tunes on the Victoria's Secret catwalk. Ginger legend!,0,13,13,5.38,82,0,0,0,4,3,,ed sheeran smashing out his tunes on the victorias secret catwalk ginger legend
715,"You're any moment, every second,|Every scent and every flower|As a girl.",0,11,10,5.64,72,0,0,0,4,6,second |Every,youre any moment every secondevery scent and every floweras a girl
716,"It's the crackhead uncle of the HBCU family ""@_KKoolPoINtz_: Every HBCU in Alabama looks at Alabama State sideways lmao!""",0,19,16,5.42,121,0,0,1,6,8,crackhead @,its the crackhead uncle of the hbcu family  every hbcu in alabama looks at alabama state sideways laughing my ass off
717,@user @user yeah I'm avoiding you by waking up at 6 AM my time so by 10 PM I'm exhausted.  #sucksimissedyou <3,1,22,19,4.0,110,0,1,1,10,7,exhausted sucksimissedyou,  yeah im avoiding you by waking up at  am my time so by  pm im exhausted  sucksimissedyou 
718,Watch amazing race contestant talk juicy!,0,6,6,6.0,41,0,0,0,0,1,,watch amazing race contestant talk juicy
719,love being able to be comfortable in my own roomðŸ˜ƒðŸ‘,1,10,10,4.1,50,0,0,0,6,0,able comfortable own,love being able to be comfortable in my own roomðŸ˜ƒðŸ‘
720,"Sometimes I wonder, am I the mouse, or am I the experimenter?",0,12,8,4.17,61,0,0,0,8,3,,sometimes i wonder am i the mouse or am i the experimenter
721,A day where  ruled @user I got followed by @user Wht a  day!! Lollllll.,1,14,13,4.0,71,0,0,1,5,5,,a day where  ruled  i got followed by  wht a  day lollllll
722,Oh how I love fainting randomly,1,6,6,4.33,31,0,0,0,2,0,,oh how i love fainting randomly
723,So glad they've found a way to make the gospel socially relevant to klingons!,1,14,13,4.57,77,0,0,0,6,2,glad relevant,so glad theyve found a way to make the gospel socially relevant to klingons
724,I promote #EDM why would I add jazz? Some ppl will do anything 2b popular #SoObvious #WTF #AttentionWhore #keepitreal,0,19,18,5.21,117,0,1,0,6,6,popular SoObvious,i promote edm why would i add jazz some ppl will do anything b popular soobvious wtf attentionwhore keepitreal
725,"@user yeah I did, because it didn't show the convo and stuff, was gonna text it you but NO :)",0,20,19,3.7,93,0,0,1,11,6,, yeah i did because it didnt show the convo and stuff was gonna text it you but no 
726,Not felt this I'll since I was in kos! Eugh a great end to a great week......  #beenshite #killme,1,19,17,4.11,97,0,1,0,10,10,great great beenshite,not felt this ill since i was in kos eugh a great end to a great week  beenshite killme
727,"Azealia Banks call Iggy ""Igloo Australian""...WOOOW an incredible rapper diss another one",1,12,12,6.42,88,0,0,0,1,5,Azealia incredible,azealia banks call iggy igloo australianwooow an incredible rapper diss another one
728,There is nothing I love more than listening to the black eyed peas on the way home from a Saturday night loss in petrolia #killerband,1,25,24,4.36,133,0,1,0,12,1,black eyed petrolia,there is nothing i love more than listening to the black eyed peas on the way home from a saturday night loss in petrolia killerband
729,@user All #U Can Do Beautiful Is Your #BEST Winning Is  Important Taking Part & Having Fun Is What Matter's :-),0,21,19,4.29,111,0,1,1,9,8,, all u can do beautiful is your best winning is  important taking part  having fun is what matters 
730,I think I might be an artist  #flowers #pretty #love #beautiful #painting #art #nature #lchs,1,15,14,5.13,92,0,1,0,4,8,artist beautiful,i think i might be an artist  flowers pretty love beautiful painting art nature lchs
731,@user what for ? waste of time...:),0,7,7,4.14,35,0,0,1,3,7,, what for  waste of time
732,"at least... I've got spine, cause I can feel the pain in my back. #thinkpositive|",1,15,15,4.47,81,0,1,0,7,8,,at least ive got spine cause i can feel the pain in my back thinkpositive
733,@user anytime! Cash is acceptable every where. And can be used toward whatever they want/need.,0,15,15,5.33,94,0,0,1,5,5,user acceptable, anytime cash is acceptable every where and can be used toward whatever they wantneed
734,It's funny because your a fake ass bitch :) #yourAtruefriendtoher,1,10,10,5.6,65,0,1,0,4,4,funny fake,its funny because your a fake ass bitch  youratruefriendtoher
735,So far today I burned my tongue on my coffee. Saw a dead guy on the freeway and chipped the windshield in the truck #gonnahaveagoodday,1,25,21,4.4,134,0,1,0,12,2,dead,so far today i burned my tongue on my coffee saw a dead guy on the freeway and chipped the windshield in the truck gonnahaveagoodday
736,I love my mom,1,4,4,2.5,13,0,0,0,2,0,,i love my mom
737,@user He's just trying to drive Suh's price up.,1,9,9,4.33,47,0,0,1,3,4,, hes just trying to drive suhs price up
738,"@user @user it's ok Kev, Gurney's bowling the next over",1,10,9,4.6,55,0,0,1,3,5,ok next,  its ok kev gurneys bowling the next over
739,@user @user do you wanna cry? That's how you cry. Omg,0,11,9,3.91,53,0,0,1,5,5,,  do you wanna cry thats how you cry omg
740,I picked a great night to not want to sleep.,1,10,9,3.5,44,0,0,0,5,1,great,i picked a great night to not want to sleep
741,"But hey, 1 study guide for chemistry down 5 to go",0,11,11,3.55,49,0,0,0,4,1,,but hey  study guide for chemistry down  to go
742,@user nah dude my buddy puked all over steak and shake,0,11,11,4.0,54,0,0,1,4,1,nah, nah dude my buddy puked all over steak and shake
743,@user ooooo touching myself to ODB he is the greatest Giants player to ever play the game... Screw that the best player ever!!,1,23,19,4.52,126,0,0,1,10,6,, ooooo touching myself to odb he is the greatest giants player to ever play the game screw that the best player ever
744,Might go back to bed it's easier then making the effort @user   #wrong ðŸ˜‚ðŸ˜­,0,14,14,4.14,73,0,1,1,4,3,wrong,might go back to bed its easier then making the effort    wrong ðŸ˜‚ðŸ˜­
745,AHHH WINNER AND EPIK HIGH. #2014MAMA,0,6,6,5.17,36,0,1,0,1,2,,ahhh winner and epik high mama
746,Babysitting night! Hoping my car doesn't get towed bc idk where to park ðŸ˜°,0,14,14,4.29,73,0,0,0,5,2,,babysitting night hoping my car doesnt get towed bc idk where to park ðŸ˜°
747,I have to leave for school at 9am and I'm still in bed #fucktherain #wherearemyhunters #imgonnalooksocutetoday,1,16,16,5.94,110,0,1,0,8,4,,i have to leave for school at am and im still in bed fucktherain wherearemyhunters imgonnalooksocutetoday
748,3 hours of sleep is sufficient to tackle this day.  #timezoneproblems,1,11,11,5.27,69,0,1,0,4,2,sufficient, hours of sleep is sufficient to tackle this day  timezoneproblems
749,day 3 : sun|but it's not sunny today â˜|#DecemberPhotoChallenge #france #sun #or  #today #day3...,0,14,14,5.86,96,0,1,0,2,13,sunny sun,day   sunbut its not sunny today â˜decemberphotochallenge france sun or  today day
750,So this week is just getting better and better  ðŸ˜­,1,10,9,3.9,49,0,0,0,5,0,,so this week is just getting better and better  ðŸ˜­
751,"Grandma's coming over, yay money. #lol #kidding",1,7,7,5.86,47,0,1,0,0,5,yay lol,grandmas coming over yay money lol kidding
752,S/O to the Bengals for sucking it up yesterday. Totally made it worth me staying up 24 hours yesterday and coming to work this am.,1,25,22,4.24,130,0,0,0,11,3,,so to the bengals for sucking it up yesterday totally made it worth me staying up  hours yesterday and coming to work this am
753,"#Hunger #has  #vanished #from #our #affluent, even #overweight, #society â€“",0,10,10,6.4,74,0,1,0,0,10,,hunger has  vanished from our affluent even overweight society â€“
754,Gripping new ebook not for the fainthearted or politically correct. Please visit site,0,13,13,5.62,85,0,0,0,4,1,new fainthearted correct,gripping new ebook not for the fainthearted or politically correct please visit site
755,"soon, stop, wtf, and omg are deff my fav things to hear ðŸ˜‚",1,13,13,3.46,57,0,0,0,4,3,deff fav,soon stop wtf and omg are deff my fav things to hear ðŸ˜‚
756,25 Historical Images That Normalize #Breastfeeding via @user We're so more tolerant now...,1,13,13,6.0,90,0,1,1,4,6,Historical tolerant, historical images that normalize breastfeeding via  were so more tolerant now
757,crushes are great until you realize they'll never be interested in you.| :p,1,13,13,4.85,75,0,0,0,6,4,great interested,crushes are great until you realize theyll never be interested in you p
758,I'm so glad I work a double on New Year's Eve and then most of New Year's Day...  #pissed,1,19,17,3.68,89,0,1,0,9,7,glad double,im so glad i work a double on new years eve and then most of new years day  pissed
759,I love finals week! #justkidding  #stressed,1,6,6,6.17,43,0,1,0,1,3,,i love finals week justkidding  stressed
760,Funny Annoying You Men's Tee Great for family reunions! #funny  #tees,1,11,11,5.27,69,0,1,0,2,4,funny,funny annoying you mens tee great for family reunions funny  tees
761,"@user Because your ""sarcastic""?",1,4,4,7.0,31,0,0,1,2,4,sarcastic, because your sarcastic
762,@user I'm not a Lohan anymore ðŸ˜ detox now for 4 weeks new me! 1 week tomorrow ðŸ˜˜,0,18,18,3.44,79,0,0,1,4,3,new, im not a lohan anymore ðŸ˜ detox now for  weeks new me  week tomorrow ðŸ˜˜
763,Chasing my dog though the house  fun,0,7,7,4.14,36,0,0,0,2,0,,chasing my dog though the house  fun
764,Huge for @user RT @user Congrats to today's #12DaysOfChristmasSweatersContest winner @user,0,11,9,7.27,90,0,1,1,2,5,,huge for  rt  congrats to todays daysofchristmassweaterscontest winner 
765,They don't even listen to ur order talk about great customer service ðŸ‘Ž,1,13,13,4.46,70,0,0,0,4,1,great,they dont even listen to ur order talk about great customer service ðŸ‘Ž
766,Ah @user soul show making my Sunday morning at work more bearable #cold yet #happy,0,15,15,4.53,82,0,1,1,3,3,user bearable cold happy,ah  soul show making my sunday morning at work more bearable cold yet happy
767,"There's no such thing as ""too much ammo""",0,8,8,4.12,40,0,0,0,4,3,such much,theres no such thing as too much ammo
768,It's the most wonderful time of the fiscal year :(|,1,10,9,4.2,51,0,0,0,5,4,wonderful fiscal,its the most wonderful time of the fiscal year 
769,@user Is it snowing in Canada? Just on the hills here at the minute but hoping for a white Christmas,0,20,19,4.05,100,0,0,1,12,2,@ white, is it snowing in canada just on the hills here at the minute but hoping for a white christmas
770,How Badly Do You Need That Burrito? (That's sounds naughty) #burrito,0,11,11,5.27,68,0,1,0,4,5,,how badly do you need that burrito thats sounds naughty burrito
771,Well today has just started off great.,1,7,7,4.57,38,0,0,0,3,1,great,well today has just started off great
772,I love being on hold. Especially when the music is so great.,1,12,12,4.08,60,0,0,0,7,2,great,i love being on hold especially when the music is so great
773,Hit Them Angles And Duck Face To Hide Those Wrinkles ; ) #ThatsABossBitchRightThere . . . !!,1,17,15,4.47,92,0,1,0,4,8,,hit them angles and duck face to hide those wrinkles   thatsabossbitchrightthere    
774,At least my tan looks good ðŸ˜³ðŸ˜‚  need to learn to appreciate my pale skin ðŸ™ˆ,1,16,14,3.56,73,0,0,0,5,0,tan good pale,at least my tan looks good ðŸ˜³ðŸ˜‚  need to learn to appreciate my pale skin ðŸ™ˆ
775,@user @user I won't be pledging anytime soon...why are these GROWN women competing..AKA vs DELTA...crabs in a barrel..SAD,0,18,17,5.78,121,0,0,1,7,13,vs,  i wont be pledging anytime soonwhy are these grown women competingaka vs deltacrabs in a barrelsad
776,Getting sick just in time for finals is so great,1,10,10,3.9,48,0,0,0,5,0,sick great,getting sick just in time for finals is so great
777,thanks for clearing everything up Koenig  #serialbrady,1,7,7,6.71,54,0,1,0,2,1,,thanks for clearing everything up koenig  serialbrady
778,Just received an email that I am the heir to the Nigerian Petroleum Corporation. I should immediately send them all my bank info.,1,23,21,4.65,129,0,0,0,13,2,,just received an email that i am the heir to the nigerian petroleum corporation i should immediately send them all my bank info
779,What am i doing with my life,0,7,7,3.14,28,0,0,0,6,0,i,what am i doing with my life
780,"Same as what Whoopi said about rape of 13 yo by Roman Polanski. Not ""rape rape"" b/c she was drugged. via @user",0,22,22,4.05,110,0,0,1,9,6,,same as what whoopi said about rape of  yo by roman polanski not rape rape bc she was drugged via 
781,@user have you heard back yet?!,0,6,6,4.33,31,0,0,1,2,3,, have you heard back yet
782,"oh lord!  RT @user RT @user Before becoming an actor, Tom Cruise wanted to be a Catholic priest.",1,18,16,4.33,96,0,0,1,5,5,Catholic,oh lord  rt  rt  before becoming an actor tom cruise wanted to be a catholic priest
783,Cc: @user My last tweet. Wayne's World is a great movie.,1,11,11,4.18,56,0,0,1,3,5,last great,cc  my last tweet waynes world is a great movie
784,Lady in red â¤ï¸âœ¨ðŸ’‹ðŸ‘¸ðŸ’ƒ|#ootd #im #the #mom  #the #godmother #lol #athenakairalyn #baptism #love...,0,13,12,6.23,94,0,1,0,1,14,red â¤ï¸âœ¨ðŸ’‹ðŸ‘¸ðŸ’ƒ| ootd im lol athenakairalyn,lady in red â¤ï¸âœ¨ðŸ’‹ðŸ‘¸ðŸ’ƒootd im the mom  the godmother lol athenakairalyn baptism love
785,to have a highway clean up section of highway. people expressed their freedom of speech @user @user @user,0,18,15,4.89,105,0,0,1,7,4,,to have a highway clean up section of highway people expressed their freedom of speech   
786,"@user its my workhorse, practically glued to my hand",0,9,8,4.89,52,0,0,1,4,2,, its my workhorse practically glued to my hand
787,@user @user I bet those fairways and greens rival the work of @user,1,13,11,4.23,67,0,0,1,5,3,,  i bet those fairways and greens rival the work of 
788,"#Comptroller: #CitiBike #Stations, #Bikes  #Being #Properly #Maintained: As CitiBike gears up to expand, the...",0,14,14,6.93,111,0,1,0,3,14,,comptroller citibike stations bikes  being properly maintained as citibike gears up to expand the
789, is when someone has been quite vocal against liberals but at the same time supports @user :),1,17,17,4.47,93,0,0,1,9,3,vocal same, is when someone has been quite vocal against liberals but at the same time supports  
790,and he takes calls when his phone thing works @user @user @user @user @user @user,0,15,10,4.47,81,0,0,1,4,6,,and he takes calls when his phone thing works      
791,It's so much fun to drive a front wheel drive car in the snow,1,14,13,3.43,61,0,0,0,6,1,much front,its so much fun to drive a front wheel drive car in the snow
792,Another new politician in the state with a social science degree and a liberal arts diploma... Just what we need  #greensfail,1,21,20,4.95,125,0,1,0,9,4,new social liberal,another new politician in the state with a social science degree and a liberal arts diploma just what we need  greensfail
793,Getting my midterm back was such a great start to my day  #badday,1,13,12,4.0,65,0,1,0,6,1,such great,getting my midterm back was such a great start to my day  badday
794,Same #Soundcloud dl: Follow> @user #ATL #ConsciousMusic,0,7,7,7.0,55,0,1,1,1,6,Same,same soundcloud dl follow  atl consciousmusic
795,Looking forward to mine and the boyfriends 2nd Christmas together!!ðŸ˜˜ðŸ™ŒðŸ’•,0,10,10,6.1,70,0,0,0,3,2,,looking forward to mine and the boyfriends nd christmas togetherðŸ˜˜ðŸ™ŒðŸ’•
796,@user no u dnt hav to..bt sme ppl do....evn whn they do shit.. :-P,0,14,14,3.79,66,0,0,1,3,11,u, no u dnt hav tobt sme ppl doevn whn they do shit p
797,@user @user @user first line is correct!! Can't say about the latter one!! ðŸ˜,0,14,12,4.5,76,0,0,1,4,8,first correct Ca latter,   first line is correct cant say about the latter one ðŸ˜
798,buzzing for school on monday..,1,5,5,5.2,30,0,0,0,2,2,,buzzing for school on monday
799,Fleury with 5 shut outs so far on the season. He's still not good though,1,15,15,3.87,72,0,0,0,6,2,good,fleury with  shut outs so far on the season hes still not good though
800,"Wrapping up CROTCHED MOUNTAIN commercial tonight, and packing everything up to head up to Loon Mountain Resort...",0,17,14,5.71,113,0,0,0,6,4,commercial,wrapping up crotched mountain commercial tonight and packing everything up to head up to loon mountain resort
801, tough day in sun #kitsch#funny @ Costa Teguise Lanzarote,0,9,9,5.33,57,0,1,1,1,3,tough funny, tough day in sun kitschfunny  costa teguise lanzarote
802,michael have a sexy face when he cough,1,8,8,3.88,38,0,0,0,4,0,sexy,michael have a sexy face when he cough
803,@user @user Well it's not any worse or better than 'Stark Raving',0,12,11,4.5,65,0,0,1,5,5,,  well its not any worse or better than stark raving
804,@user thanks for leaving the dish for us  #badbusiness,1,9,8,5.0,54,0,1,1,3,2,, thanks for leaving the dish for us  badbusiness
805,Just snap chatting my sister a few times.. #shelovesitwhenIsendthatmany,1,9,9,7.0,71,0,1,0,4,3,few,just snap chatting my sister a few times shelovesitwhenisendthatmany
806,@user Home page at 8:30am shows Dow -51.44 but it's +102.75. Can you make your home page stats more real-time pls?,0,21,20,4.48,114,0,0,1,7,10,+102.75 real-time, home page at am shows dow  but its  can you make your home page stats more realtime pls
807,Photo: Abstract Tribal Bubble Jumpsuit Size: s-xl Cost:$39.99,0,8,8,6.75,61,0,0,0,0,6,s-xl,photo abstract tribal bubble jumpsuit size sxl cost
808,Rain and sleet hun? Yeah I totally want to get dress and go to work. Sounds like  fun  #iwannagobacktobed,1,19,17,4.47,105,0,1,0,7,3,,rain and sleet hun yeah i totally want to get dress and go to work sounds like  fun  iwannagobacktobed
809,"My professors moustache is so uneven, Mohstash would be ashamed right now",0,12,12,5.17,73,0,0,0,5,1,uneven,my professors moustache is so uneven mohstash would be ashamed right now
810,Best Christmas gift @user new album.,0,6,6,5.17,36,0,0,1,0,2,new,best christmas gift  new album
811,my life won't be complete until I meet @user ðŸ’•,0,10,10,3.7,46,0,0,1,5,2,complete @,my life wont be complete until i meet  ðŸ’•
812,If this year wld be filled w all these rainy days it wont be so cool a cool way to start e year,0,23,20,3.17,95,0,0,0,10,0,rainy wont cool cool,if this year wld be filled w all these rainy days it wont be so cool a cool way to start e year
813,"Well that's my Becky in London with her nan, an the big girl dan too start her new job tomorrow #feelingabandoned  haha",1,22,21,4.41,119,0,1,0,9,3,big new,well thats my becky in london with her nan an the big girl dan too start her new job tomorrow feelingabandoned  haha
814,@user #me and #change were not friends I still need #time,0,11,11,4.27,57,0,1,1,4,4,, me and change were not friends i still need time
