,text,Mapping,word_count,unique_wordcount,mean_word_length,tweet_length,url_count,hashtags,mention_count,stopwords,punctuation_count,text_Adjectives,Processed_Text
1341,@user Wenger slams referee (Sky) #saintsfc ha ha ha ha for being too blatantly bias towards them?!,0,17,14,4.82,98,0,1,1,3,6,saintsfc bias, wenger slams referee sky saintsfc ha ha ha ha for being too blatantly bias towards them
1342,Ma thing,1,2,2,3.5,8,0,0,0,0,0,,ma thing
1343,@user was just about to say that ðŸ˜‚,0,8,8,3.38,34,0,0,1,5,1,, was just about to say that ðŸ˜‚
1344,@user I am procrastinating on getting work done b/c I am reading your new book!,1,15,13,4.33,79,0,0,1,6,3,new, i am procrastinating on getting work done bc i am reading your new book
1345,I think the new sweater I bought is a maternity sweater. Oh well. Its super cozy,0,16,15,4.06,80,0,0,0,6,2,new super,i think the new sweater i bought is a maternity sweater oh well its super cozy
1346,My FIVE days of #Christmas shared.. #infosec  #hirefriday #humor,0,9,9,6.11,64,0,1,0,2,6,infosec hirefriday,my five days of christmas shared infosec  hirefriday humor
1347,I'm so afraid.,1,3,3,4.0,14,0,0,0,2,2,afraid,im so afraid
1348,Yellow Pages are all you need. Phone books are the future. #truth #reallynotreally,1,13,12,5.38,82,0,1,0,5,4,Yellow,yellow pages are all you need phone books are the future truth reallynotreally
1349,"@user @user @user this is shallow af, stop discriminating eyes, all eyes are beautiful.",1,14,12,5.29,87,0,0,1,4,6,shallow beautiful,   this is shallow af stop discriminating eyes all eyes are beautiful
1350,Love these cold winter mornings ðŸ˜¬ best feeling everrrrrrr !,1,10,10,5.0,59,0,0,0,1,1,cold,love these cold winter mornings ðŸ˜¬ best feeling everrrrrrr 
1351,"Stop trying to make me post my location, twitter. I don't want to post my location. Stop.",0,17,14,4.29,89,0,0,0,7,5,,stop trying to make me post my location twitter i dont want to post my location stop
1352,@user @user @user because as long as she's a victim she'll have white knights trying to save that damsel in distress.,1,21,18,4.62,117,0,0,1,10,6,white,   because as long as shes a victim shell have white knights trying to save that damsel in distress
1353,On a small diet,1,4,4,3.0,15,0,0,0,2,0,small,on a small diet
1354,When I'm doing my hw at the same time with watching series. #1am #now #still  #finish #my #work! #,0,19,19,4.16,98,0,1,0,8,10,same finish,when im doing my hw at the same time with watching series am now still  finish my work 
1355,#notcies #eu Keeping deficits down: How successful is the EUs budget-surveillance mechanism?,0,12,12,6.75,92,0,1,0,3,5,How successful,notcies eu keeping deficits down how successful is the eus budgetsurveillance mechanism
1356,"@user That's a much nicer idea, actually.",0,7,7,5.0,41,0,0,1,2,4,much, thats a much nicer idea actually
1357,@user hope you had a nice Xmas babes X,0,9,9,3.33,38,0,0,1,3,1,nice, hope you had a nice xmas babes x
1358,@user Is Jameis Winston getting paid for this photo or is #5 coincidence?,1,13,13,4.69,73,0,1,1,5,3,@, is jameis winston getting paid for this photo or is  coincidence
1359," ""@BarakRavid: BREAKING: PM Netanyahu slams EU countries: ""The Europeans are hypocrites that learned nothing from the holocaust""""",1,17,17,6.59,129,0,0,1,4,8,,  breaking pm netanyahu slams eu countries the europeans are hypocrites that learned nothing from the holocaust
1360,A wonderful day of starting work at 6am,1,8,8,4.0,39,0,0,0,3,0,wonderful,a wonderful day of starting work at am
1361,About once a yr I get a little nutty and reach for the orange marmalade. #livingontheedge,1,16,15,4.62,89,0,1,0,9,2,little nutty,about once a yr i get a little nutty and reach for the orange marmalade livingontheedge
1362,"There's millions of autobot & troll accounts on Twitter that post dumb sh*t for RT's, then people call them stupid & naive.||",1,22,21,4.73,125,0,0,0,7,9,dumb stupid naive.||,theres millions of autobot  troll accounts on twitter that post dumb sht for rts then people call them stupid  naive
1363,"@user Never ending, pointless, no cunt wins, tit for tat. Zero accountability and hunners of finger pointing.",0,17,17,5.47,109,0,0,1,4,6,, never ending pointless no cunt wins tit for tat zero accountability and hunners of finger pointing
1364,@user @user @user Awesome! And well deserved.,0,7,5,5.57,45,0,0,1,1,5,,   awesome and well deserved
1365,I wonder what Professor Iaukea has to say about the new Disney Princess...? ðŸ˜’,1,14,14,4.57,77,0,0,0,6,4,new,i wonder what professor iaukea has to say about the new disney princess ðŸ˜’
1366,@user @user @user Fuck yeah! 600 more viewers!,1,8,6,4.88,46,0,0,1,1,5,,   fuck yeah  more viewers
1367,"they don't sing live, but they sure are hella good looking #smh",0,12,11,4.33,63,0,1,0,5,3,live hella good,they dont sing live but they sure are hella good looking smh
1368,"Ahhh 7 a.m bedtimes, how I've missed you  #examproblems",1,9,9,5.11,55,0,1,0,3,4,,ahhh  am bedtimes how ive missed you  examproblems
1369,What normal people see vs. what I see @user,0,9,8,3.89,43,0,0,1,3,2,normal @,what normal people see vs what i see 
1370,This pressure is unreal. Keep it up,0,7,7,4.14,35,0,0,0,4,1,unreal,this pressure is unreal keep it up
1371,Off to a slow start this morning . ðŸ˜©,0,9,9,3.11,36,0,0,0,4,1,slow,off to a slow start this morning  ðŸ˜©
1372,"Dad and step mom bitching at each other, now it's Christmas ðŸ˜ŠðŸŽ„ðŸ˜¤  #ugh",1,13,13,4.31,69,0,1,0,4,3,other,dad and step mom bitching at each other now its christmas ðŸ˜ŠðŸŽ„ðŸ˜¤  ugh
1373,but the USA HIPPA laws prohibit the Psychiatrist from releasing that info @user @user,0,14,12,5.14,85,0,0,1,5,2,info,but the usa hippa laws prohibit the psychiatrist from releasing that info  
1374,Shout outs to the guy who took a shower in 1 Million before heading out. The WHOLE BUS thanks you,1,20,20,3.9,97,0,0,0,8,1,,shout outs to the guy who took a shower in  million before heading out the whole bus thanks you
1375,@user his song Angel of Death is a good one. It has lyrics bashing the Vatican,1,16,16,3.94,78,0,0,1,7,2,good, his song angel of death is a good one it has lyrics bashing the vatican
1376,God bless whoever came up with the idea of making coloureds bruh..not cape colourds thou,0,15,15,4.93,88,0,0,0,4,2,bruh..not,god bless whoever came up with the idea of making coloureds bruhnot cape colourds thou
1377,"@user sorry, missed off my  tag from the end of my tweet",0,12,11,3.67,56,0,0,1,6,2,, sorry missed off my  tag from the end of my tweet
1378,Why couldn't I just stay sleeping,0,6,6,4.67,33,0,0,0,4,1,,why couldnt i just stay sleeping
1379,I'm ready for @user first headlining tour of North America! Tickets/info at #lunatic2015,0,13,13,5.85,88,0,1,1,4,5,ready,im ready for  first headlining tour of north america ticketsinfo at lunatic
1380,"@user logic is an invention by the kuffar, everything makes perfect sense. () Like monkeys stoning she monkeys",1,18,17,5.17,110,0,0,1,6,5,user perfect, logic is an invention by the kuffar everything makes perfect sense  like monkeys stoning she monkeys
1381,@user someone's on the defensive...if the shoe fits ðŸ¸â˜•ï¸,0,9,8,5.22,55,0,0,1,3,5,, someones on the defensiveif the shoe fits ðŸ¸â˜•ï¸
1382,"@user @user Really?! This is absolutely below the belt, especially towards Tom Boon ... #DeepRespect ...",1,16,14,5.56,104,0,1,1,4,12,,  really this is absolutely below the belt especially towards tom boon  deeprespect 
1383,"Today's court proceedings, allowing prisoners access to books in England & Wales, surely confirms it's time to limit judicial review.",1,20,19,5.7,133,0,0,0,4,6,judicial,todays court proceedings allowing prisoners access to books in england  wales surely confirms its time to limit judicial review
1384,@user mocking a spiritually precious holiday for millions is just so courageous of you... #shameonyou,1,15,15,5.8,101,0,1,1,6,5,precious courageous, mocking a spiritually precious holiday for millions is just so courageous of you shameonyou
1385,Bet that was #limbs in the Sunderland end,0,8,8,4.25,41,0,1,0,4,1,,bet that was limbs in the sunderland end
1386,@user @user the only scary Bollywood film I've watched is Bhootnaath,1,11,10,5.27,68,0,0,1,4,3,only scary,  the only scary bollywood film ive watched is bhootnaath
1387,...but then it started itself and made the Windows noise. So starts this exciting day of mine...!,1,17,17,4.76,97,0,0,0,8,8,exciting,but then it started itself and made the windows noise so starts this exciting day of mine
1388,love is bliss...,1,3,3,4.67,16,0,0,0,1,3,bliss,love is bliss
1389,@user @user @user @user @user @user @user @user 9 Followers and now he's relevant?,1,14,7,4.93,82,0,0,1,2,10,relevant,         followers and now hes relevant
1390, feeling well,0,2,2,5.5,13,0,0,0,0,0,, feeling well
1391,"Lawyer on train to other lawyer talking about ceiling ad- ""who would even read that? No one's going to notice that thing...""",1,22,21,4.68,124,0,0,0,8,8,other ad-,lawyer on train to other lawyer talking about ceiling ad who would even read that no ones going to notice that thing
1392,Merry Christmas love Instagram ðŸ˜‚ #gifts  #spam,1,7,7,5.57,46,0,1,0,0,2,,merry christmas love instagram ðŸ˜‚ gifts  spam
1393,@user The fact that Whites are prone to universal thinking is actually racial in and of itself.,1,17,17,4.65,95,0,0,1,8,2,prone universal racial, the fact that whites are prone to universal thinking is actually racial in and of itself
1394,Sad to hear about @user passing. His family and friends are in my prayers today. #rip @user,0,17,16,4.41,91,0,1,1,7,5,rip,sad to hear about  passing his family and friends are in my prayers today rip 
1395,Nothing says welcome to home better than this. #wemissedyoutoo,1,9,9,6.0,62,0,1,0,2,2,,nothing says welcome to home better than this wemissedyoutoo
1396,@user :)) thank you so much. Such a generous display of kindness from your side.,0,15,15,4.4,80,0,0,1,7,6,@ generous,  thank you so much such a generous display of kindness from your side
1397,Just found the picture of lisazamorano trying to kill me #bff at our #seniorbrunch @ Moutain Meadows,0,17,17,4.94,100,0,1,1,7,3,,just found the picture of lisazamorano trying to kill me bff at our seniorbrunch  moutain meadows
1398,#WreathAcrossAmerica #Jax it is finnished #honor #FallenHeros in Jax||http://t.co/OXybfwwWb6,0,9,9,9.33,92,1,1,0,3,11,finnished honor,wreathacrossamerica jax it is finnished honor fallenheros in jax
1399,You know its a gonna be a good day when your roommate comes in saying she just took her aderol and is about to have an anxiety attack,1,28,27,3.79,133,0,0,0,17,0,good,you know its a gonna be a good day when your roommate comes in saying she just took her aderol and is about to have an anxiety attack
1400,We prefer to lose the derby vs #SuC and fight for Ligna trophy.,1,13,13,3.92,63,0,1,0,5,2,,we prefer to lose the derby vs suc and fight for ligna trophy
1401,Wow I feel so bad that you had to actually do your job as a teacher.  #stopcomplaing,1,17,17,3.94,84,0,1,0,10,2,bad,wow i feel so bad that you had to actually do your job as a teacher  stopcomplaing
1402,"It is so much easier for me to write how I'm feeling than to actually speak it, I get nervous and stumble on my words if it's on my heart.",0,30,27,3.63,138,0,0,0,19,4,much nervous stumble,it is so much easier for me to write how im feeling than to actually speak it i get nervous and stumble on my words if its on my heart
1403,Quizfreak #proud #Brummie over here xxx,0,6,6,5.67,39,0,1,0,2,2,proud,quizfreak proud brummie over here xxx
1404,Look!: #Poulan #Chainsaw #New #shopping #chain  #saws #start #starting #will #wont,0,11,11,6.45,82,0,1,0,0,12,saws,look poulan chainsaw new shopping chain  saws start starting will wont
1405,History check anyone know what this is?,0,7,7,4.71,39,0,0,0,2,1,,history check anyone know what this is
1406,@user plus my memory is short and I deleted all those pic you shared. Boom.,1,15,15,4.07,75,0,0,1,7,3,user short, plus my memory is short and i deleted all those pic you shared boom
1407,wow what great banter from @user,1,6,6,4.5,32,0,0,1,2,1,great,wow what great banter from 
1408,"Maaaaan stupid instagram I went from having 300+ followers, to my cat my mom and tom from MySpace -_-..... #smh  #butstill !!!",0,22,20,4.73,126,0,1,0,8,15,stupid smh,maaaaan stupid instagram i went from having  followers to my cat my mom and tom from myspace  smh  butstill 
1409,"@user followup to Ferguson/stereotyping talk is audio about a kid who wants to do ""hood-rat"" stuff?",1,16,15,5.25,99,0,0,1,7,6,audio hood-rat, followup to fergusonstereotyping talk is audio about a kid who wants to do hoodrat stuff
1410,@user @user Nice but  original,0,5,4,5.0,30,0,0,1,1,2,original,  nice but  original
1411,"Appreciate @user that he has spared suspending our accounts, only blocked us.",1,12,12,5.5,77,0,0,1,5,3,,appreciate  that he has spared suspending our accounts only blocked us
1412,Oh the  - a gas hauling semi with FLAMMABLE signs all over it - and the driver is smoking. #truestory #I10 #Texas2015,1,22,20,4.32,117,0,1,0,9,6,truestory,oh the   a gas hauling semi with flammable signs all over it  and the driver is smoking truestory i texas
1413,i can always count on freshmen to make the library loud. THANKS,1,12,12,4.33,63,0,0,0,5,1,library,i can always count on freshmen to make the library loud thanks
1414,"@user   :/ still Q10, still one of the best :D",0,10,9,3.5,46,0,0,1,2,5,@,    still q still one of the best d
1415,"Oh materialism, how I've missed you.",1,6,6,5.17,36,0,0,0,2,3,,oh materialism how ive missed you
1416,"@user @user @user Obama , like DiFi with #TortureReport is using the 'scorched earth"" method.#tcot",0,15,13,5.6,98,0,1,1,4,9,,   obama  like difi with torturereport is using the scorched earth methodtcot
1417,@user @user @user That is fine company!,0,7,5,4.71,39,0,0,1,2,4,fine,   that is fine company
1418,Stinker of a day... Nothing has gone right. Got worse as the day went on... #Ahhhhhhhhh #Depression #CantWaitForTomorrow,1,18,18,5.72,120,0,1,0,5,10,,stinker of a day nothing has gone right got worse as the day went on ahhhhhhhhh depression cantwaitfortomorrow
1419,"Too late, thrown the #PS4 out of the window last night cus i couldn't play",1,15,14,4.0,74,0,1,0,7,3,last,too late thrown the ps out of the window last night cus i couldnt play
1420,@user @user Second prize is TWO signed copies of Boris' book. #onlyKidding,1,12,11,5.25,74,0,1,1,2,5,user,  second prize is two signed copies of boris book onlykidding
1421,"@user @user ""Unity we stand"" all white people.",1,8,7,4.88,46,0,0,1,2,5,white,  unity we stand all white people
1422,@user @user yip most likely the next time I get #suckered into #making anotherone ðŸ˜œ,0,15,14,4.6,83,0,1,1,5,4,likely next,  yip most likely the next time i get suckered into making anotherone ðŸ˜œ
1423,Staying #casual #monday #funday  #ootd #fashion #style #allyouneedisstyle #todayimwearing,1,9,9,8.89,89,0,1,0,0,8,casual monday funday ootd allyouneedisstyle,staying casual monday funday  ootd fashion style allyouneedisstyle todayimwearing
1424,Let's just not pretend for once. .,0,7,7,4.0,34,0,0,0,4,3,,lets just not pretend for once 
1425,My fingers smell like lavashak :),0,6,6,4.67,33,0,0,0,2,2,,my fingers smell like lavashak 
1426,@user regarding what the PSU president does,0,7,7,5.29,43,0,0,1,3,1,, regarding what the psu president does
1427,Please dont fuck with me when I first wake up a morning person!,0,13,13,3.92,63,0,0,0,6,1,,please dont fuck with me when i first wake up a morning person
1428,It's beginning to look a lot like Christmas! #timetodecorate #tistheseason,0,10,10,6.5,74,0,1,0,4,4,timetodecorate,its beginning to look a lot like christmas timetodecorate tistheseason
1429,Oh how I love this,1,5,5,2.8,18,0,0,0,3,0,,oh how i love this
1430,Don't forget to join @user for #Steak Night tonight starting at 4pm! #nyc #food #foodie,0,15,15,4.87,87,0,1,1,4,7,nyc,dont forget to join  for steak night tonight starting at pm nyc food foodie
1431,"It's hot, it's humid & you're wearing uggs. Wow. Nice style!",1,11,11,4.55,60,0,0,0,3,8,hot humid uggs,its hot its humid  youre wearing uggs wow nice style
1432,It will be impossible for me to be late if I start to dress up right now. #studing #university #lazy,1,20,18,4.05,100,0,1,0,10,4,impossible late,it will be impossible for me to be late if i start to dress up right now studing university lazy
1433,Yet another angry #Bluehand moron blocks me after just one tweet :-p,1,12,12,4.75,68,0,1,0,3,3,angry,yet another angry bluehand moron blocks me after just one tweet p
1434,"Company profile NOT TWINS VENTURES, LLC -   #TWINS #VENTURES, #LLC",0,10,10,5.5,66,0,1,0,1,6,,company profile not twins ventures llc    twins ventures llc
1435,Ooh! Someone knows how to click the 'Unfollow' button. I'm impressed!  #beforeCoffee,1,12,12,6.0,84,0,1,0,4,7,impressed,ooh someone knows how to click the unfollow button im impressed  beforecoffee
1436,A tiring selfiee!!but yet looks #freshh :P Aftr long work!!! I love unii,1,13,13,4.62,72,0,1,0,2,7,long unii,a tiring selfieebut yet looks freshh p aftr long work i love unii
1437,"Yeah Hastings, Rose, Bird and Beer is a much better 8-11 than Richardson, Zampa, Laughlin and Tait.",1,17,16,4.88,99,0,0,0,5,6,,yeah hastings rose bird and beer is a much better  than richardson zampa laughlin and tait
1438,The last time I'll get up at 6:30am I'll miss this,1,11,10,3.64,50,0,0,0,7,3,last,the last time ill get up at am ill miss this
1439,2 days off the next two weeks. 3 in the new yr. Love working over xmas.  #needthemoney,1,17,16,4.06,86,0,1,0,5,4,next new, days off the next two weeks  in the new yr love working over xmas  needthemoney
1440,@user |My Jambo buddy sees a more Scottish identity emerging for HMFC.|The John Wilson types can travel to Govan.|,1,19,19,5.05,114,0,0,1,5,6,|My Scottish, my jambo buddy sees a more scottish identity emerging for hmfcthe john wilson types can travel to govan
1441,"Japan's #Abe #gets #the #mandate #he #wanted #Ã¢â‚¬"" #but  the #recovery he wanted: Japan's Prime Minister Shinzo...",0,17,16,5.65,113,0,1,0,2,16,,japans abe gets the mandate he wanted Ã¢â‚¬ but  the recovery he wanted japans prime minister shinzo
1442,IS IT FRIDAY? *heavy sigh* Nooo. It Is totally Wednesday~! What a MESS. Wait 2 more days.,0,17,17,4.29,89,0,0,0,7,8,*heavy Wednesday~,is it friday heavy sigh nooo it is totally wednesday what a mess wait  more days
1443,@user haha they were never nice. Guess I'm not cool enough ðŸ˜” #sadface,0,13,13,4.38,69,0,1,1,4,4,nice cool ðŸ˜”, haha they were never nice guess im not cool enough ðŸ˜” sadface
1444,Confucius Motivational Quotes FREE ANDROID APP,0,6,6,6.83,46,0,0,0,0,0,,confucius motivational quotes free android app
1445,"@user Gonna miss @user @user @user and others, but at least we got Howie Kendrick...  #NotStoked #WTF",1,17,14,4.94,101,0,1,1,4,10,, gonna miss    and others but at least we got howie kendrick  notstoked wtf
1446,Thank you @user for these amazing candles from the new series of @user #atmosphere...,0,14,13,5.14,85,0,1,1,6,6,amazing new,thank you  for these amazing candles from the new series of  atmosphere
1447,The #blackbrunchnyc hashtag got the racists goin up on a Sunday...ðŸ˜’,0,11,11,5.18,67,0,1,0,5,4,,the blackbrunchnyc hashtag got the racists goin up on a sundayðŸ˜’
1448,Watch father and not his daughter FUCK #Old+Young #father #and,0,10,10,5.3,62,0,1,0,3,4,,watch father and not his daughter fuck oldyoung father and
1449,im in some place where the word 'job' means stealing,0,10,10,4.3,52,0,0,0,4,2,,im in some place where the word job means stealing
1450,"Prediction: Erv Santana will be disinterested in playing for the Twins in 2015 too... (aka, we didn't offer enough)",0,19,18,5.11,115,0,0,0,7,8,,prediction erv santana will be disinterested in playing for the twins in  too aka we didnt offer enough
1451,I bet its warmer in Nova Scotia today! #frio #cold #freezing #costadelsol   #IloveCanada,1,13,13,5.69,88,0,1,0,3,6,frio cold costadelsol,i bet its warmer in nova scotia today frio cold freezing costadelsol   ilovecanada
1452,Say no more.... #bigclub,1,4,4,5.25,24,0,1,0,1,5,,say no more bigclub
1453,@user @user what's going on with sharks hair? Looks like the council has cut it,0,15,14,4.33,79,0,0,1,7,4,,  whats going on with sharks hair looks like the council has cut it
1454,@user @user @user @user @user @user @user not now guys finals ðŸ’¯,0,12,6,4.33,63,0,0,1,1,7,guys,       not now guys finals ðŸ’¯
1455,650 return flight. Why I love my family. #familyvacation,1,9,9,5.33,56,0,1,0,3,3,, return flight why i love my family familyvacation
1456,@user @user @user if not your ðŸ‘ŠðŸ‘Š box them up yeah ðŸ˜‚ðŸ˜‚,0,12,10,3.42,52,0,0,1,5,3,,   if not your ðŸ‘ŠðŸ‘Š box them up yeah ðŸ˜‚ðŸ˜‚
1457,"whoever just did the hunger games whistle on the quiet floor, I applaud you on your originality and cultural relevance  #oldjoke",1,21,19,5.1,128,0,1,0,10,2,quiet cultural,whoever just did the hunger games whistle on the quiet floor i applaud you on your originality and cultural relevance  oldjoke
1458,I'm going to Finnish all my homework and get caught up on everything over the break,1,16,16,4.25,83,0,0,0,10,1,,im going to finnish all my homework and get caught up on everything over the break
1459,"I love getting woken up by my body just to say ""I know you were comfortable sleeping.. But here's something you don't want anyway""",1,24,23,4.46,130,0,0,0,12,6,comfortable,i love getting woken up by my body just to say i know you were comfortable sleeping but heres something you dont want anyway
1460,Good thing y days not ruined....,1,6,6,4.5,32,0,0,0,1,4,Good,good thing y days not ruined
1461,I have such a wonderful gf!,1,6,6,3.67,27,0,0,0,4,1,wonderful,i have such a wonderful gf
1462,Why everything must b turned into a disaster to avenge another disaster?What's so gratifying in forgetting tht we all are humans/Pakistanis?,0,21,21,5.71,140,0,0,0,9,4,gratifying,why everything must b turned into a disaster to avenge another disasterwhats so gratifying in forgetting tht we all are humanspakistanis
1463,Yea I love it when 2 is already throwing a tantrum upon waking up. Totally. Awesome. ðŸ‘Œ  @user,1,18,18,4.17,93,0,0,1,5,4,,yea i love it when  is already throwing a tantrum upon waking up totally awesome ðŸ‘Œ  
1464,": World's most villainous climate criminal, Australia, attempts to heavy other nations at Lima #auspol",1,15,15,5.87,102,0,1,0,4,5,villainous other, worlds most villainous climate criminal australia attempts to heavy other nations at lima auspol
1465,So glad to be off work,0,6,6,2.83,22,0,0,0,4,0,glad,so glad to be off work
1466,Fuck pure clothes though!!!  spoiled just blessedðŸ’ª,0,7,7,6.14,50,0,0,0,1,3,,fuck pure clothes though  spoiled just blessedðŸ’ª
1467,@user but it wasn't as bad as that picture seemed to indicate.  You're still a very horrible person.,1,18,17,4.56,100,0,0,1,10,5,@ bad horrible, but it wasnt as bad as that picture seemed to indicate  youre still a very horrible person
1468,Wish she could have told me herself. @user #nicolescherzinger #OneLove #myfav #MyQueen â¤ï¸â¤ï¸,0,13,13,6.08,91,0,1,1,4,6,Wish user,wish she could have told me herself  nicolescherzinger onelove myfav myqueen â¤ï¸â¤ï¸
1469,you are the one LYING @user @user @user @user @user,0,10,6,4.2,51,0,0,1,3,5,,you are the one lying     
1470,Some guy chattin shit to me on the bus saying I look like snoop dogg #KMT #again,0,17,17,3.76,80,0,1,0,7,2,,some guy chattin shit to me on the bus saying i look like snoop dogg kmt again
1471,@user don't let fuckboys get in the way of you being happy never have AND never will. Lmao  #DontBelieveMeJustWatch,1,19,18,5.05,115,0,1,1,9,4,happy, dont let fuckboys get in the way of you being happy never have and never will lmao  dontbelievemejustwatch
1472,I have to say that Misty with Johnny Mathis is one of my favourites,0,14,14,3.86,67,0,0,0,8,0,,i have to say that misty with johnny mathis is one of my favourites
1473,@user Deutsch is a misogynistic toad; how shocking he's a bigot too  .... #HandsUpDontShoot,1,14,13,5.5,91,0,1,1,6,8,user misogynistic, deutsch is a misogynistic toad how shocking hes a bigot too   handsupdontshoot
1474,"@user @user oh aye, I'll give you that ; )",0,10,9,3.3,42,0,0,1,3,6,,  oh aye ill give you that  
1475,This link will be relevant in a couple of days.,0,10,10,3.8,47,0,0,0,5,1,relevant,this link will be relevant in a couple of days
1476,"@user Now, Tomorrow productivity at work would be hampered. #GetMeToEVC",0,10,10,6.2,71,0,1,1,3,4,, now tomorrow productivity at work would be hampered getmetoevc
1477,Just got an email from the law school saying 3 people have infringed copyright by not referencing properly..in our essay on copyright,1,22,21,5.09,133,0,0,0,9,2,,just got an email from the law school saying  people have infringed copyright by not referencing properlyin our essay on copyright
1478,How far would you go for #safety? #onlinedating #relationships via @user,0,11,11,5.64,72,0,1,1,4,5,,how far would you go for safety onlinedating relationships via 
1479,"@user @user @user BF4 SP is shit, while the MP was broken for 11 months so...",0,16,14,3.88,77,0,0,1,5,7,,   bf sp is shit while the mp was broken for  months so
1480,People aren't as beautiful as they look #people  #beautiful #look #walk #talk #personality #love #care #share,0,16,15,5.81,109,0,1,0,4,10,beautiful beautiful,people arent as beautiful as they look people  beautiful look walk talk personality love care share
1481,Eeeek cinema date with the boo this weekendðŸ™ˆðŸ’•,0,8,8,4.75,45,0,0,0,3,0,Eeeek,eeeek cinema date with the boo this weekendðŸ™ˆðŸ’•
1482,Awesome rainy day at the track!!,1,6,6,4.5,32,0,0,0,2,2,Awesome rainy,awesome rainy day at the track
