,text,Mapping,word_count,unique_wordcount,mean_word_length,tweet_length,url_count,hashtags,mention_count,stopwords,punctuation_count,text_Adjectives,Processed_Text
2152,Lol at docs who don't know what they're doing.  #fuckthat,1,10,10,4.7,57,0,1,0,5,4,,lol at docs who dont know what theyre doing  fuckthat
2153,@user did you get fat on your honeymoon?,0,8,8,4.12,40,0,0,1,5,2,, did you get fat on your honeymoon
2154,@user So you condone murder for rude people?||File that under Nincompoop Update,0,12,12,5.67,79,0,0,1,5,4,rude, so you condone murder for rude peoplefile that under nincompoop update
2155,Makes perfect sense to get mad about something that happen 4+ years ago.,1,13,13,4.62,72,0,0,0,4,2,mad,makes perfect sense to get mad about something that happen  years ago
2156,Agree with @user @user some people sigh so others will hear them. My husband sighs all the time. Around me. #Curious,1,21,20,4.57,116,0,1,1,6,6,Curious,agree with   some people sigh so others will hear them my husband sighs all the time around me curious
2157,Cool.,1,1,1,5.0,5,0,0,0,0,1,,cool
2158,@user Jackie Just Had the Best Joke I've Heard In Awhile| ðŸ˜‚ðŸ˜©ðŸ™ˆðŸ™ˆðŸ™ˆ,1,12,12,4.33,63,0,0,1,5,3,user, jackie just had the best joke ive heard in awhile ðŸ˜‚ðŸ˜©ðŸ™ˆðŸ™ˆðŸ™ˆ
2159, at its core. #trolls looking for #trolls. The second coming is soon. #itm #noagenda,1,14,14,5.0,84,0,1,0,5,7,second itm, at its core trolls looking for trolls the second coming is soon itm noagenda
2160,#Laundrymatfun#LOL#YesIsaidNOT#spincycle#youspinmeround#recordplayer#thatsmykid#80smusic#teachingth,1,1,1,99.0,99,0,1,0,0,9,thatsmykid,laundrymatfunlolyesisaidnotspincycleyouspinmeroundrecordplayerthatsmykidsmusicteachingth
2161,Thank you behh! Loveyou! :) @user #bestfriends #behh #beh #sweet #love #distance  #to #far...,0,14,14,5.64,93,0,1,1,1,16,user beh sweet,thank you behh loveyou   bestfriends behh beh sweet love distance  to far
2162,Watching Christmas movies alone is like so much fun.,1,9,9,4.89,52,0,0,0,3,1,much,watching christmas movies alone is like so much fun
2163,"..@Youtube : Keeping the big channels big, and the little channels irrelevant since 2014 . #GoodJob",1,16,14,5.25,99,0,1,1,4,7,.. big big little,  keeping the big channels big and the little channels irrelevant since   goodjob
2164,"The word ""Taliban"" comes from the root word ""Talib"" which means a student. |#PeshawarAttack #DeathToTaliban #DeathToISIS",1,16,15,6.56,120,0,1,0,5,9,|,the word taliban comes from the root word talib which means a student peshawarattack deathtotaliban deathtoisis
2165,"I like how people freak out when they hear I'm still getting paid while I'm off for over 2 weeks. Join the military, duh.",0,24,23,4.08,121,0,0,0,13,5,military,i like how people freak out when they hear im still getting paid while im off for over  weeks join the military duh
2166,Drinking a Mercury: The Winged Messenger (Planet Series) by @user - #photo,0,12,12,5.25,74,0,1,1,3,6,,drinking a mercury the winged messenger planet series by   photo
2167,"Math presentation, ap history test, ap science test, and whatever the hell we're doing in Asgill... Today should be fun!",1,20,18,5.05,120,0,0,0,7,8,ap,math presentation ap history test ap science test and whatever the hell were doing in asgill today should be fun
2168,@user I know it was you Fredo. You broke my heart!,0,11,11,3.64,50,0,0,1,6,3,, i know it was you fredo you broke my heart
2169,@user I can't wait :) Enjoy your Christmas!,0,8,8,4.5,43,0,0,1,3,5,, i cant wait  enjoy your christmas
2170, #Congressmen Admit to  reading #NDAA before #Voting |<3;-}><3|Via @user,0,9,9,6.89,72,0,1,1,2,12,, congressmen admit to  reading ndaa before voting via 
2171,Andrew Luck is some kind of QB... Wowzers. #INDvsCLE,0,9,9,4.89,52,0,1,0,3,5,,andrew luck is some kind of qb wowzers indvscle
2172,@user @user what???? No verbal submission?,1,6,5,6.17,42,0,0,1,1,7,verbal,  what no verbal submission
2173,"Selfish, narcissistic. Only the woman matters. Child doesn't matter. Father doesn't matter. No one else matters.|http://t.co/1olMSFOTd7",0,16,14,7.5,135,1,0,0,6,14,Selfish narcissistic,selfish narcissistic only the woman matters child doesnt matter father doesnt matter no one else matters
2174,MAMA - a Korean awards show that will be held in Hong Kong and will be headlined by an American artist,1,21,19,3.9,102,0,0,0,8,1,Korean American,mama  a korean awards show that will be held in hong kong and will be headlined by an american artist
2175,@user WHO LOOK SO MUCH ALIKE OMG lashwkaywiduwb,0,8,8,5.0,47,0,0,1,2,1,, who look so much alike omg lashwkaywiduwb
2176,Left home at 7.30am and still trying to get to work. I just want to cry!! #happymonday,1,17,15,4.12,86,0,1,0,8,5,,left home at am and still trying to get to work i just want to cry happymonday
2177,@user .@JebBush considering a run for the @user #5Things <shocking> <>,1,11,10,5.45,70,0,1,1,3,9,< >,  considering a run for the  things shocking 
2178,Connacht Camogie champions 2014! 3 years in a row! Hon HRC! #MountbellewIsAHurlingStronghold  #HolyRosary4life #SeniorB ðŸ˜„ðŸ™ŒðŸ†âš¾,0,15,15,7.27,124,0,1,0,2,6,,connacht camogie champions   years in a row hon hrc mountbellewisahurlingstronghold  holyrosarylife seniorb ðŸ˜„ðŸ™ŒðŸ†âš¾
2179,@user large companies don't pay tax and get away with it.individuals who don't pay get locked up or fined.,1,19,16,4.63,106,0,0,1,9,5,large, large companies dont pay tax and get away with itindividuals who dont pay get locked up or fined
2180,The quest for #GoSupersonic tickets continue -_-,0,7,7,6.0,48,0,1,0,2,4,,the quest for gosupersonic tickets continue 
2181,Lol! I m enjoying itðŸ‘­ #Talks #Crazyness #SheNeverLeft  sleepy!! â˜º,0,10,10,5.5,65,0,1,0,1,6,itðŸ‘­,lol i m enjoying itðŸ‘­ talks crazyness sheneverleft  sleepy â˜º
2182,"@user Of all the Spice Girls, you'd pick her?!",0,9,9,4.22,46,0,0,1,4,5,, of all the spice girls youd pick her
2183,Pediatric Grand Rounds on statin therapy and the dyslipidemia of obesity. Breakfast on offer is 2 grand platters of donuts.,1,20,18,5.2,123,0,0,0,7,2,grand,pediatric grand rounds on statin therapy and the dyslipidemia of obesity breakfast on offer is  grand platters of donuts
2184,"showed mom this picture of me and @user & says ""this is grunge"" and she goes ""haha!! I love it!"" #momgoals",0,21,20,4.1,106,0,1,1,8,10,grunge haha,showed mom this picture of me and   says this is grunge and she goes haha i love it momgoals
2185,"finally going to bed, definitely looking forward to waking up in 5 1/2 hours. ðŸ‘",1,15,14,4.33,79,0,0,0,4,3,,finally going to bed definitely looking forward to waking up in   hours ðŸ‘
2186,@user @user wish I was there. maybe next year. I'll be the one with the mad socks. no clothes. just socks.,0,21,18,4.1,106,0,0,1,9,8,wish next,  wish i was there maybe next year ill be the one with the mad socks no clothes just socks
2187,Gee faculty at nicholls are so helpful,1,7,7,4.57,38,0,0,0,3,0,helpful,gee faculty at nicholls are so helpful
2188,The sky looks SO beautiful today....,1,6,6,5.17,36,0,0,0,2,4,beautiful,the sky looks so beautiful today
2189,Thirst will make you settle for a grenade bruh,0,9,9,4.22,46,0,0,0,3,0,,thirst will make you settle for a grenade bruh
2190,@user You're slipping back into hate figure territory,0,8,8,5.75,53,0,0,1,2,2,, youre slipping back into hate figure territory
2191,My christmas gift... i have sweetest friends :) #blessed,1,9,9,5.33,56,0,1,0,3,6,,my christmas gift i have sweetest friends  blessed
2192,I'll just assume Rex Grossman is starting.,0,7,7,5.14,42,0,0,0,3,2,,ill just assume rex grossman is starting
2193,@user your busy staff  standing about when people queue #joke,1,10,10,5.1,61,0,1,1,3,2,busy, your busy staff  standing about when people queue joke
2194,@user when ur boyfriend interrupts your selfie yeah happens all the time,1,12,12,5.08,72,0,0,1,4,1,ur selfie, when ur boyfriend interrupts your selfie yeah happens all the time
2195,thts impoxible koz the late kajwangs brother is stil alive and kan occupy the seat but raila,0,17,16,4.47,92,0,0,0,5,0,impoxible late stil alive kan,thts impoxible koz the late kajwangs brother is stil alive and kan occupy the seat but raila
2196,"2AM on Christmas Day, and we're heating up Pizza and Breadsticks. #theboysarebackintown",0,12,11,6.33,87,0,1,0,5,4,theboysarebackintown,am on christmas day and were heating up pizza and breadsticks theboysarebackintown
2197,Check out some things I've been really loving recently during the holiday season!,0,13,13,5.31,81,0,0,0,6,2,,check out some things ive been really loving recently during the holiday season
2198,Apparently it's hang up on Ashley dayðŸ˜„,0,7,7,4.57,38,0,0,0,3,1,,apparently its hang up on ashley dayðŸ˜„
2199,Welcome to twitter @user myself n @user r at ur service as ur twitter coaches,1,15,12,4.2,77,0,0,1,5,2,ur ur,welcome to twitter  myself n  r at ur service as ur twitter coaches
2200,I'm not staring at your boobs hun..I'm looking at your heart #relax,0,12,10,4.67,67,0,1,0,6,5,,im not staring at your boobs hunim looking at your heart relax
2201,#YouAndIBackToYoutube WHAT???!WHY???!! ITS CHRISTMAS! ITS FORBIDDEN TO DO SUCH TERRIBILE THINGS! GIVE IT BACK TO US! @user,0,17,15,6.24,122,0,1,1,7,14,,youandibacktoyoutube whatwhy its christmas its forbidden to do such terribile things give it back to us 
2202,How do we end up talking? ..oh wait..we don't talk..whooops #cutestcouple,1,11,11,5.73,73,0,1,0,5,9,,how do we end up talking oh waitwe dont talkwhooops cutestcouple
2203,Aaand the hits just keep on coming. #BadDay,0,8,8,4.5,43,0,1,0,3,2,,aaand the hits just keep on coming badday
2204,Didnt have no time to wake and bake this mornin  winnin ðŸ˜¡ðŸ™…,0,12,12,3.83,58,0,0,0,5,0,,didnt have no time to wake and bake this mornin  winnin ðŸ˜¡ðŸ™…
2205,@user 's twitter game is perfect tonight! #amazingness,0,8,8,5.88,54,0,1,1,1,4,perfect, s twitter game is perfect tonight amazingness
2206,"@user #InkRivals ok,we all know Cleen is going to win, lets just end it. Not exciting. AMEN TO THAT",0,19,19,4.26,99,0,1,1,7,6,, inkrivals okwe all know cleen is going to win lets just end it not exciting amen to that
2207,@user @user I expected some sort of apple quip but that's why you guys do the jokes and I do the news tbh,0,23,19,3.61,105,0,0,1,13,3,,  i expected some sort of apple quip but thats why you guys do the jokes and i do the news tbh
2208,big up @user 4 ur post When cunts run through your photosðŸ˜’ #its#a#struggle#its#a#problem check da n...,0,16,16,5.44,102,0,1,1,4,10,big ur photosðŸ˜’,big up   ur post when cunts run through your photosðŸ˜’ itsastruggleitsaproblem check da n
2209,@user Sig-ni-fi-cant witter,1,3,3,8.33,27,0,0,1,0,4,@ user Sig-ni-fi-cant, significant witter
2210,Check out my new post! MyFairDaily: 10 Things I've Been Loving Lately #lbloggers #holidays #myfairdaily #favorites,0,16,16,6.19,114,0,1,0,4,7,new,check out my new post myfairdaily  things ive been loving lately lbloggers holidays myfairdaily favorites
2211,It's not possible to have enough time,0,7,7,4.43,37,0,0,0,4,1,possible enough,its not possible to have enough time
2212,@user you wearing the pin I sent for the rest of the video yesterday made my day. #daymade #addicted,0,19,17,4.32,100,0,1,1,8,4,daymade, you wearing the pin i sent for the rest of the video yesterday made my day daymade addicted
2213,Climate change redux: CALIFORNIANS experience drought & voted for bonds to cover.Climate changed &now we have most rain in 100 years.,1,21,21,5.38,133,0,0,0,6,5,CALIFORNIANS,climate change redux californians experience drought  voted for bonds to coverclimate changed now we have most rain in  years
2214, Putin praising Constitutional Court for defending against 'arbitrary action on the part of the government,1,15,14,6.07,106,0,0,0,6,1,'arbitrary, putin praising constitutional court for defending against arbitrary action on the part of the government
2215,Perfect time to get really sick  ðŸ˜«ðŸ˜·,1,7,7,4.0,35,0,0,0,2,0,Perfect sick,perfect time to get really sick  ðŸ˜«ðŸ˜·
2216,Jordan fan here|| ðŸ˜› -not a hater.,1,7,7,3.86,33,0,0,0,1,4,,jordan fan here ðŸ˜› not a hater
2217,#All #Cute #Dude #Girlygirl #I039m #Into #Is |Please RT:,0,9,9,5.33,56,0,1,0,0,9,|Please,all cute dude girlygirl im into is please rt
2218,"Hey, @user DenialCSGO decided that they want to replace @user and I'm their new player. #NAShuffle Nobody is safe. #CSGO",1,20,19,5.05,120,0,1,1,7,8,new safe,hey  denialcsgo decided that they want to replace  and im their new player nashuffle nobody is safe csgo
2219,Here comes the universe. #TMLtalk #Leafs,0,6,6,5.83,40,0,1,0,2,3,universe,here comes the universe tmltalk leafs
2220,I had the best New Years!!!! Spent it with the people I love & I fucking loved it! ðŸ˜ Such a happy camper right now! ðŸ˜ðŸ’šâ¤ï¸,0,26,23,3.65,120,0,0,0,10,7,Such happy,i had the best new years spent it with the people i love  i fucking loved it ðŸ˜ such a happy camper right now ðŸ˜ðŸ’šâ¤ï¸
2221,@user Why? He has draft pick compensation tied to his name and is only six months younger.,0,17,17,4.35,90,0,0,1,7,3,pick, why he has draft pick compensation tied to his name and is only six months younger
2222,2a TL shows Lester's 6/$155m deal's a hit Boston - Wish all announcements were made when parties involved least coherent #Notsarcasm,1,21,21,5.33,132,0,1,0,4,6,Wish coherent,a tl shows lesters m deals a hit boston  wish all announcements were made when parties involved least coherent notsarcasm
2223,"replurks acatholicprayer: Lord Jesus Christ, Son of God, have mercy on me, a sinner! #Catholic #prayer",0,16,16,5.44,102,0,1,0,4,7,,replurks acatholicprayer lord jesus christ son of god have mercy on me a sinner catholic prayer
2224,Thank you Aidyn and Adele for getting me sick.,1,9,9,4.22,46,0,0,0,4,1,sick,thank you aidyn and adele for getting me sick
2225,@user Hey #Russia ! MAKE MONEY #TWEETING YET?||http://t.co/Q2WB7riAvK <-This #FOXNews Clip explains how||https://t.co/cpJZkEgNe7,0,13,13,8.92,128,2,1,1,0,22,//t.co/Q2WB7riAvK, hey russia  make money tweeting yet this foxnews clip explains how
2226,"Ã¯""?#Depression and #Abuse are sadly a part of many people's testimonies My Monster of a secret: #DamonLeroi",0,17,15,5.35,107,0,1,0,7,7,many secret,Ã¯depression and abuse are sadly a part of many peoples testimonies my monster of a secret damonleroi
2227,"@user wow, that is some fluent finnish",1,7,7,4.57,38,0,0,1,3,2,fluent finnish, wow that is some fluent finnish
2228,"Good choice to stay up late, Lys.  #study #finalsweek #deathofme",1,10,10,5.4,64,0,1,0,2,5,Good finalsweek,good choice to stay up late lys  study finalsweek deathofme
2229,@user I got manually retweeted by Zach Harper. #internetcelebrity,0,9,9,6.33,65,0,1,1,2,3,, i got manually retweeted by zach harper internetcelebrity
2230,Eating sweets in PE,1,4,4,4.0,19,0,0,0,1,0,,eating sweets in pe
2231,Thanks bus. Thanks for telling me where I am. So helpful.,1,11,10,4.27,57,0,0,0,5,3,helpful,thanks bus thanks for telling me where i am so helpful
2232,Wondering weather to have a few drinks tonight or not ðŸŽ…ðŸŽðŸŽðŸŽ„,0,11,11,4.36,58,0,0,0,6,0,few,wondering weather to have a few drinks tonight or not ðŸŽ…ðŸŽðŸŽðŸŽ„
2233,Fav part abt Xmas day..getting merry Xmas tweets from ppl who NEVER talk to me #kys #idontcare,1,17,16,4.59,94,0,1,0,4,4,kys,fav part abt xmas daygetting merry xmas tweets from ppl who never talk to me kys idontcare
2234,#your biggest task is to get me to look #how shall one do that?  looking #none of them #cleverclogs #shld #know #my #nakhre too,0,24,23,4.29,127,0,1,0,10,9,shld,your biggest task is to get me to look how shall one do that  looking none of them cleverclogs shld know my nakhre too
2235,Oh this will end well.  RT @user Military-Style Tech Finds Way Into School District Safety Measures,1,16,16,5.19,99,0,0,1,2,3,Military-Style,oh this will end well  rt  militarystyle tech finds way into school district safety measures
2236,@user Saturday at 11:00?  Damn...there goes my secret news paraphernalia....   telling,0,11,11,6.64,86,0,0,1,2,10,user secret, saturday at   damnthere goes my secret news paraphernalia   telling
2237,Big thanks to my teachers for the FOUR tests I have to take tomorrow #woohoo,1,15,14,4.13,76,0,1,0,7,1,Big,big thanks to my teachers for the four tests i have to take tomorrow woohoo
2238,"But not a grocery store or pharmacy. Sensible.  ""@GRPress: Offices or apartments? owners of Monroe Avenue factory ponder options""",1,19,18,5.79,129,0,0,1,6,7,Sensible @,but not a grocery store or pharmacy sensible   offices or apartments owners of monroe avenue factory ponder options
2239,"@user it'll be ok, just get your TA to fix it!!",1,11,11,3.36,47,0,0,1,5,5,ok, itll be ok just get your ta to fix it
2240,"I am also going to enjoy two beers, while sitting in my car. That is  illegal. What was done to me at USC Medical, and at Penn Mar, is.",0,29,27,3.66,135,0,0,0,16,6,illegal,i am also going to enjoy two beers while sitting in my car that is  illegal what was done to me at usc medical and at penn mar is
2241,@user isnt it obvious #Sadhvi case and #Rape cases are 2 different things. You cannot co-relate both thngs to 1 sentence,1,21,21,4.76,120,0,1,1,7,5,obvious different, isnt it obvious sadhvi case and rape cases are  different things you cannot corelate both thngs to  sentence
2242,Working cart today..gonna make that money! . 35 golfers all day ðŸ˜’ðŸ”«,1,12,12,4.58,66,0,0,0,2,4,,working cart todaygonna make that money   golfers all day ðŸ˜’ðŸ”«
2243,"Thanks to #TeamIpswich ED for making the news crew and I so welcome this morning, as they always do. #BlackFriday filming #ItWasQuiet",1,22,22,5.09,133,0,1,0,9,5,welcome,thanks to teamipswich ed for making the news crew and i so welcome this morning as they always do blackfriday filming itwasquiet
2244,Yay for another work at 4am day ðŸ˜,1,8,8,3.25,33,0,0,0,2,0,,yay for another work at am day ðŸ˜
2245,"Do...or do not. There is no try. - #Yoda ""Do. Do not. Try. Try again. Repeat until you get it right."" - #JarrodDavis",0,23,21,4.09,116,0,1,0,9,16,,door do not there is no try  yoda do do not try try again repeat until you get it right  jarroddavis
2246,@user Vote-Who is the most underrated actor? jimmy#oters  got ter fame im,0,12,12,5.08,73,0,1,1,3,4,@ user underrated jimmy ter, votewho is the most underrated actor jimmyoters  got ter fame im
2247,"@user Also, I would not that my tone was joking, though it's difficult to properly convey that in a Tweet.",1,20,19,4.35,106,0,0,1,11,5,difficult, also i would not that my tone was joking though its difficult to properly convey that in a tweet
2248,"#Net #neutrality: #Cisco, #Intel, #IBM #warn #FCC  #to #crack #down #on #ISPs: More than 60 #technology...",0,16,16,5.62,106,0,1,0,2,20,Net,net neutrality cisco intel ibm warn fcc  to crack down on isps more than  technology
2249,Plan on using the last 16% of my battery on listening to @user @user get through the day #bigâ˜†now,0,19,16,4.16,97,0,1,1,9,4,last user,plan on using the last  of my battery on listening to   get through the day bigâ˜†now
2250,Congrats still SASMVT for a good run. Ulitin nalang ulit ang 6-peat next year :),0,15,15,4.4,80,0,0,0,2,4,good nalang ulit 6-peat next,congrats still sasmvt for a good run ulitin nalang ulit ang peat next year 
2251,Baking bread and hanging with a glass of wine in leggings and a sweatshirt with football on. HEAVEN! If only the snow hadn't turned to rain.,0,26,23,4.42,140,0,0,0,13,4,,baking bread and hanging with a glass of wine in leggings and a sweatshirt with football on heaven if only the snow hadnt turned to rain
2252,My favorite dreams are the ones where you wake up covered in tears.,1,13,13,4.23,67,0,0,0,7,1,favorite,my favorite dreams are the ones where you wake up covered in tears
2253,@user I guess not. Stop insulting me.,0,7,7,4.43,37,0,0,1,1,3,, i guess not stop insulting me
2254,Thinking I should lock my phone away for the night: #ifyoudonthaveanythingnicetosaydontsayanythingatall,0,11,11,8.45,103,0,1,0,5,2,,thinking i should lock my phone away for the night ifyoudonthaveanythingnicetosaydontsayanythingatall
2255,"Second major nosebleed of the day has halted my training efforts. Nares, this means war.",0,15,15,4.93,88,0,0,0,5,3,Second major,second major nosebleed of the day has halted my training efforts nares this means war
2256,Jack doesn't understand twitter. Thoughts?,0,5,5,7.6,42,0,0,0,1,3,,jack doesnt understand twitter thoughts
2257,@user @user The number 2 play was awesome.,1,8,7,4.38,42,0,0,1,2,3,awesome,  the number  play was awesome
2258,#indonesian#czech#mix#girl#with#my#boy#elvis#im#single by mcrodyn,0,3,3,21.0,65,0,1,0,1,10,indonesian czech mix girl boy elvis im single,indonesianczechmixgirlwithmyboyelvisimsingle by mcrodyn
2259,"Yo I got ten squad members in Khajo Chris said as he tears up...|""You ain't a gang member..."" Kevin responded |#thuglife",1,21,21,4.76,120,0,1,0,5,12,ten squad gang,yo i got ten squad members in khajo chris said as he tears upyou aint a gang member kevin responded thuglife
2260,@user wants me to get hit by a bus so she can get a 4.0 #bestroomieaward,1,16,14,3.56,72,0,1,1,10,3,, wants me to get hit by a bus so she can get a  bestroomieaward
2261,Even Soweto TV didn't bother to show these fvcken awards...useless to the bone..go figure,0,14,13,5.43,89,0,0,0,5,6,fvcken,even soweto tv didnt bother to show these fvcken awardsuseless to the bonego figure
2262,@user How do you score on someone?,0,7,7,4.0,34,0,0,1,4,2,, how do you score on someone
2263,Long time no see #long#along#time#times#no#see#me#you#i#your#say#hi#hello#want#wanna#to#meet @user,0,6,6,15.5,98,0,1,1,1,18,Long i hi hello,long time no see longalongtimetimesnoseemeyouiyoursayhihellowantwannatomeet 
2264,Interviewed a turkey & here's what he had to say #Thanksgiving,0,11,11,4.73,62,0,1,0,6,3,,interviewed a turkey  heres what he had to say thanksgiving
2265,There was a shooting in my old neighborhood where my family lives. Praying everyone is okay and stays safe â¤ï¸,0,20,19,4.5,109,0,0,0,9,1,old okay safe,there was a shooting in my old neighborhood where my family lives praying everyone is okay and stays safe â¤ï¸
2266,stl.You Will Never Win Again RT @user New Manager? New Striker? New Transfer Committee? (cont),0,15,13,5.33,94,0,0,1,1,7,,stlyou will never win again rt  new manager new striker new transfer committee cont
2267,"@user The badger crusade continues.|""Gloucestershire badger patrols triggered by illegal trapping fears""|http://t.co/rF5aAmpC5n",0,12,11,9.67,127,1,0,1,2,11,illegal, the badger crusade continuesgloucestershire badger patrols triggered by illegal trapping fears
2268,@user @user ^^^^ IMAGINE THAT? Never would have guessed,1,9,8,5.22,55,0,0,1,2,7,,   imagine that never would have guessed
2269,Bridal#jewels#exciting range#hand made#high quality jewellery on the high street#bespoke#custom,0,9,9,9.67,95,0,1,0,2,6,high high,bridaljewelsexciting rangehand madehigh quality jewellery on the high streetbespokecustom
2270,My dogs like to be nice and toasty while relaxing at home #adorable #puppy #socute #icant,0,16,16,4.62,89,0,1,0,7,4,nice toasty adorable puppy socute,my dogs like to be nice and toasty while relaxing at home adorable puppy socute icant
2271,#Indonesia -- #Four #large #parts of #crashed #AirAsia #jet #found #on #sea #floor. via @user,0,15,15,5.27,93,0,1,1,1,15,large crashed,indonesia  four large parts of crashed airasia jet found on sea floor via 
2272,"Mmmm RT @user !!!! @user Faved. @user If Southampton wins, I'll post a nude..""",0,14,12,4.64,78,0,0,1,3,13,@,mmmm rt    faved  if southampton wins ill post a nude
2273,"@user and among 8 of #duleepSingh children,none had one!",1,9,9,5.33,56,0,1,1,3,4,duleepSingh, and among  of duleepsingh childrennone had one
2274,There was a point where the effort was coming in only one direction. I left and that there was a 180Â° change in direction,1,24,20,4.08,121,0,0,0,15,1,,there was a point where the effort was coming in only one direction i left and that there was a Â° change in direction
2275,@user another case of away the lads  or to put it in song tell me why we don't do north london !! #TyneWeirSunday,1,23,23,3.91,113,0,1,1,11,5,north, another case of away the lads  or to put it in song tell me why we dont do north london  tyneweirsunday
2276,@user @user gotta be a joke about tootin a Horn somewhere,0,11,9,4.27,57,0,0,1,4,2,,  gotta be a joke about tootin a horn somewhere
2277,really not sure I want to be in this place today #SoMuchBadNegativity #SmileYouFuckTards stop dragging my day down !!!,0,19,19,5.26,118,0,1,0,8,5,sure,really not sure i want to be in this place today somuchbadnegativity smileyoufucktards stop dragging my day down 
2278,We all have them people on Instagram who put the most pointless hashtags #Can #you,0,15,15,4.53,82,0,1,0,8,2,pointless,we all have them people on instagram who put the most pointless hashtags can you
2279,Woke up crying because of the nightmare I had... gonna be a great day,1,14,14,4.0,69,0,0,0,7,3,great,woke up crying because of the nightmare i had gonna be a great day
2280,ÃƒÂ¢Ã‹Å“Ã… Find out about some of our Hip Hop mixtape promotion packages,0,12,12,4.67,67,0,0,0,5,0,,Ã£Â¢Ã«Å“Ã¥ find out about some of our hip hop mixtape promotion packages
2281,Good to see Tomas Rosicky playing tdae #ARSvQPR,0,8,8,5.0,47,0,1,0,1,1,Good,good to see tomas rosicky playing tdae arsvqpr
2282,#MIley #Cyrus #Is  #The #Bad #Influence â€“ Sources Say Patrick Schwarzenegger Is!: Miley Cyrus has been dating...,0,17,17,5.59,112,0,1,0,2,11,,miley cyrus is  the bad influence â€“ sources say patrick schwarzenegger is miley cyrus has been dating
